{
  "$schema": "https://json-schema.org/draft/2020-12/schema",
  "$id": "https://oentike.local/atlas/card.schema.json",
  "title": "OentikeAtlasCard",
  "type": "object",
  "additionalProperties": false,
  "required": [
    "edibility",
    "slug",
    "names",
    "scientific_name",
    "identifiers",
    "hymenophore",
    "habitat",
    "phenology",
    "lookalikes",
    "protection_pl",
    "citations",
    "pack_version",
    "reviewed_at",
    "text_en"
  ],
  "properties": {
    "edibility": {
      "type": "object",
      "additionalProperties": false,
      "required": ["status", "note_pl", "note_en", "source"],
      "properties": {
        "status": {"enum": ["edible", "conditional", "disputed", "inedible", "poisonous", "deadly"]},
        "note_pl": {"type": "string", "minLength": 1},
        "note_en": {"type": "string", "minLength": 1},
        "source": {"type": "string", "pattern": "^https://"}
      }
    },
    "slug": {
      "type": "string",
      "pattern": "^[a-z0-9]+(-[a-z0-9]+)*$",
      "description": "Stable machine id. UI must not show the slug as the primary label."
    },
    "names": {
      "type": "object",
      "description": "Human-facing labels. UI shows PL or EN first; Latin stays secondary.",
      "additionalProperties": false,
      "required": [
        "pl",
        "en"
      ],
      "properties": {
        "pl": {
          "type": "string",
          "minLength": 1,
          "description": "Primary label in Polish UI."
        },
        "en": {
          "type": "string",
          "minLength": 1,
          "description": "Primary label in English UI."
        }
      }
    },
    "scientific_name": {
      "type": [
        "string",
        "null"
      ],
      "description": "Latin binomial shown beside/under the common name, never instead of it. Null until checked against a taxonomy source."
    },
    "identifiers": {
      "type": "object",
      "additionalProperties": false,
      "properties": {
        "mycobank": {
          "type": [
            "string",
            "null"
          ]
        },
        "index_fungorum": {
          "type": [
            "string",
            "null"
          ]
        },
        "gbif": {
          "type": [
            "string",
            "null"
          ]
        }
      }
    },
    "hymenophore": {
      "type": "string",
      "enum": [
        "pores",
        "gills",
        "folds",
        "other"
      ],
      "description": "Boletes must be pores - never gills."
    },
    "habitat": {
      "type": [
        "string",
        "null"
      ],
      "description": "Short habitat note for PL forests; cite the source."
    },
    "phenology": {
      "type": [
        "string",
        "null"
      ],
      "description": "Seasonality in Poland or temperate Europe; cite the source."
    },
    "lookalikes": {
      "type": "array",
      "items": {
        "type": "object",
        "additionalProperties": false,
        "required": [
          "slug",
          "note",
          "note_en"
        ],
        "properties": {
          "slug": {
            "type": "string"
          },
          "note": {
            "type": "string",
            "description": "Write the distinction in plain language; mention the other card by common name when possible."
          },
          "note_en": {
            "type": "string",
            "minLength": 1
          }
        }
      }
    },
    "protection_pl": {
      "type": [
        "string",
        "null"
      ],
      "description": "Legal status in Poland if any; null if unchecked, not 'unknown invented'."
    },
    "citations": {
      "type": "array",
      "items": {
        "type": "object",
        "additionalProperties": false,
        "required": [
          "label",
          "url"
        ],
        "properties": {
          "label": {
            "type": "string"
          },
          "url": {
            "type": [
              "string",
              "null"
            ]
          }
        }
      }
    },
    "art": {
      "type": "object",
      "additionalProperties": false,
      "description": "Four required distinct anatomical SVG paths; an optional comparison plate.",
      "required": ["cap", "stem", "section", "hymenophore"],
      "properties": {
        "cap": {
          "type": "string",
          "minLength": 1
        },
        "hymenophore": {
          "type": "string",
          "minLength": 1
        },
        "stem": {
          "type": "string",
          "minLength": 1
        },
        "section": {
          "type": "string",
          "minLength": 1
        },
        "lookalike_plate": {
          "type": [
            "string",
            "null"
          ]
        }
      }
    },
    "pack_version": {
      "type": "string"
    },
    "reviewed_at": {
      "type": [
        "string",
        "null"
      ],
      "description": "YYYY-MM-DD when a human checked the citations; null until then."
    },
    "description": {
      "type": [
        "string",
        "null"
      ],
      "description": "Source-backed morphology note; illustrations are schematic."
    },
    "text_en": {
      "type": "object",
      "additionalProperties": false,
      "required": [
        "description",
        "habitat",
        "phenology",
        "protection_pl"
      ],
      "properties": {
        "description": {
          "type": [
            "string",
            "null"
          ],
          "minLength": 1
        },
        "habitat": {
          "type": [
            "string",
            "null"
          ],
          "minLength": 1
        },
        "phenology": {
          "type": [
            "string",
            "null"
          ],
          "minLength": 1
        },
        "protection_pl": {
          "type": [
            "string",
            "null"
          ],
          "minLength": 1
        }
      }
    }
  }
}
