{
  "slug": "boletus-edulis",
  "edibility": {
    "status": "edible",
    "note_pl": "Gatunek jadalny po prawidłowym rozpoznaniu i odpowiednim przygotowaniu.",
    "note_en": "Edible species only after correct identification and appropriate preparation.",
    "source": "https://www.first-nature.com/fungi/boletus-edulis.php"
  },
  "names": {
    "pl": "Borowik szlachetny",
    "en": "Porcini"
  },
  "scientific_name": "Boletus edulis",
  "identifiers": {
    "mycobank": null,
    "index_fungorum": null,
    "gbif": null
  },
  "hymenophore": "pores",
  "habitat": "Lasy iglaste i mieszane, często pod świerkiem, sosną i bukiem; gleby raczej kwaśne do świeżych, wilgotne po opadach.",
  "phenology": "Lato i jesień - zwykle od lipca do października, gdy gleba jest wilgotna po deszczach.",
  "lookalikes": [
    {
      "slug": "tylopilus-felleus",
      "note": "Goryczak żółciowy: pory z wiekiem różowawe, siateczka na trzonie ciemniejsza.",
      "note_en": "Bitter bolete: pores become pinkish with age and the net-like pattern on the stem is darker."
    },
    {
      "slug": "boletus-reticulatus",
      "note": "Borowik usiatkowany: siateczka zwykle na całym trzonie, kapelusz często suchy i spękany, pojawia się wcześniej w sezonie.",
      "note_en": "Summer bolete: the net-like pattern usually covers the whole stem; the cap is often dry and cracked, and fruiting starts earlier."
    }
  ],
  "protection_pl": "Nie podlega ochronie gatunkowej w Polsce.",
  "citations": [
    {
      "label": "MycoBank",
      "url": "https://www.mycobank.org/page/Name%20details%20page/name/Boletus%20edulis"
    },
    {
      "label": "Index Fungorum",
      "url": "http://www.indexfungorum.org/names/names.asp?strSort=Boletus%20edulis"
    }
  ],
  "art": {
    "cap": "/atlas/art/v0/boletus-edulis.cap.svg",
    "hymenophore": "/atlas/art/v0/boletus-edulis.hymenophore.svg",
    "stem": "/atlas/art/v0/boletus-edulis.stem.svg",
    "section": "/atlas/art/v0/boletus-edulis.section.svg",
    "lookalike_plate": null
  },
  "pack_version": "0.0.1",
  "reviewed_at": "2026-09-24",
  "text_en": {
    "description": null,
    "habitat": "Coniferous and mixed woodland, often beneath spruce, pine and beech; generally moist soils after rain.",
    "phenology": "Summer and autumn, usually July to October, when the soil is moist after rain.",
    "protection_pl": "Not subject to species protection in Poland."
  }
}
