{
  "slug": "amanita-phalloides",
  "edibility": {
    "status": "deadly",
    "note_pl": "Grzyb śmiertelnie trujący. Nie spożywaj.",
    "note_en": "Deadly poisonous mushroom. Do not eat.",
    "source": "https://www.gov.pl/attachment/d10eb276-e3f5-4c2b-8ebf-407ba6a4d693"
  },
  "names": {
    "pl": "Muchomor zielonawy (sromotnikowy)",
    "en": "Death cap"
  },
  "scientific_name": "Amanita phalloides",
  "identifiers": {
    "mycobank": null,
    "index_fungorum": null,
    "gbif": null
  },
  "hymenophore": "gills",
  "description": "Gładki kapelusz, jasne wolne blaszki, pierścień i workowata pochwa u podstawy trzonu. Gatunek śmiertelnie trujący.",
  "habitat": "W Polsce w lasach liściastych i mieszanych, zwłaszcza pod dębami i bukami; także w parkach i ogrodach.",
  "phenology": "W Polsce zwykle od lipca do października.",
  "protection_pl": null,
  "text_en": {
    "description": "Smooth cap, pale free gills, a stem ring and a sack-like volva at the base. Deadly poisonous.",
    "habitat": "In Poland, in deciduous and mixed woodland, especially beneath oak and beech; also in parks and gardens.",
    "phenology": "In Poland, usually July to October.",
    "protection_pl": null
  },
  "lookalikes": [
    {
      "slug": "macrolepiota-procera",
      "note": "Czubajka kania ma łuskowaty kapelusz i wzór na trzonie; nie ma workowatej pochwy. To nie jest pełny klucz do oznaczania.",
      "note_en": "Parasol mushroom has a scaly cap and a patterned stem, without a sack-like volva. This is not a complete identification key."
    }
  ],
  "citations": [
    {
      "label": "PSSE w Kamiennej Górze — Bezpieczne grzybobranie",
      "url": "https://www.gov.pl/web/psse-kamienna-gora/bezpieczne-grzybobranie"
    },
    {
      "label": "First Nature — Amanita phalloides",
      "url": "https://www.first-nature.com/fungi/amanita-phalloides.php"
    }
  ],
  "art": {
    "cap": "/atlas/art/v0/amanita-phalloides.cap.svg",
    "hymenophore": "/atlas/art/v0/amanita-phalloides.hymenophore.svg",
    "stem": "/atlas/art/v0/amanita-phalloides.stem.svg",
    "section": "/atlas/art/v0/amanita-phalloides.section.svg",
    "lookalike_plate": null
  },
  "pack_version": "0.0.1",
  "reviewed_at": null
}
