{
  "slug": "cantharellus-cibarius",
  "edibility": {
    "status": "edible",
    "note_pl": "Gatunek jadalny po prawidłowym rozpoznaniu i odpowiednim przygotowaniu.",
    "note_en": "Edible species only after correct identification and appropriate preparation.",
    "source": "https://www.first-nature.com/fungi/cantharellus-cibarius.php"
  },
  "names": {
    "pl": "Pieprznik jadalny (Kurka)",
    "en": "Chanterelle"
  },
  "scientific_name": "Cantharellus cibarius",
  "identifiers": {
    "mycobank": null,
    "index_fungorum": null,
    "gbif": null
  },
  "hymenophore": "folds",
  "habitat": "Lasy iglaste i liściaste, często pod sosnami i świerkami, w mchu lub pod opadłymi liśćmi.",
  "phenology": "Bardzo wczesny grzyb - od czerwca aż do późnej jesieni (listopad).",
  "lookalikes": [
    {
      "slug": "hygrophoropsis-aurantiaca",
      "note": "Lisówka pomarańczowa (fałszywa kurka) - posiada prawdziwe, cienkie blaszki (a nie fałdy), cieńszy trzon i intensywniejszy pomarańczowy kolor.",
      "note_en": "False chanterelle: thin true gills rather than blunt folds, a thinner stem and a deeper orange colour."
    }
  ],
  "protection_pl": "Nie podlega ochronie gatunkowej w Polsce.",
  "citations": [
    {
      "label": "MycoBank",
      "url": "https://www.mycobank.org/page/Name%20details%20page/name/Cantharellus%20cibarius"
    },
    {
      "label": "Index Fungorum",
      "url": "http://www.indexfungorum.org/names/names.asp?strSort=Cantharellus%20cibarius"
    }
  ],
  "art": {
    "cap": "/atlas/art/v0/cantharellus-cibarius.cap.svg",
    "hymenophore": "/atlas/art/v0/cantharellus-cibarius.hymenophore.svg",
    "stem": "/atlas/art/v0/cantharellus-cibarius.stem.svg",
    "section": "/atlas/art/v0/cantharellus-cibarius.section.svg",
    "lookalike_plate": null
  },
  "pack_version": "0.0.1",
  "reviewed_at": "2026-09-24",
  "text_en": {
    "description": null,
    "habitat": "Coniferous and deciduous woodland, often beneath pine and spruce, among moss or fallen leaves.",
    "phenology": "From June into late autumn, sometimes November.",
    "protection_pl": "Not subject to species protection in Poland."
  }
}
