{
  "slug": "tylopilus-felleus",
  "edibility": {
    "status": "inedible",
    "note_pl": "Niejadalny ze względu na silną gorycz.",
    "note_en": "Inedible due to intense bitterness.",
    "source": "https://www.first-nature.com/fungi/tylopilus-felleus.php"
  },
  "names": {
    "pl": "Goryczak żółciowy",
    "en": "Bitter bolete"
  },
  "scientific_name": "Tylopilus felleus",
  "identifiers": {
    "mycobank": null,
    "index_fungorum": null,
    "gbif": null
  },
  "hymenophore": "pores",
  "habitat": "Lasy iglaste i mieszane, często na uboższych, piaszczystych glebach; bywa pod sosną i świerkiem.",
  "phenology": "Lato i jesień - sezon zbliżony do borowika szlachetnego.",
  "lookalikes": [
    {
      "slug": "boletus-edulis",
      "note": "Borowik szlachetny: pory z wiekiem żółtawe, nie różowe; siateczka delikatniejsza u góry trzonu.",
      "note_en": "Porcini: pores become yellowish rather than pink, and the net-like pattern near the top of the stem is finer."
    }
  ],
  "protection_pl": "Nie podlega ochronie gatunkowej w Polsce.",
  "citations": [
    {
      "label": "MycoBank",
      "url": "https://www.mycobank.org/page/Name%20details%20page/name/Tylopilus%20felleus"
    },
    {
      "label": "Index Fungorum",
      "url": "http://www.indexfungorum.org/names/names.asp?strSort=Tylopilus%20felleus"
    }
  ],
  "art": {
    "cap": "/atlas/art/v0/tylopilus-felleus.cap.svg",
    "hymenophore": "/atlas/art/v0/tylopilus-felleus.hymenophore.svg",
    "stem": "/atlas/art/v0/tylopilus-felleus.stem.svg",
    "section": "/atlas/art/v0/tylopilus-felleus.section.svg",
    "lookalike_plate": null
  },
  "pack_version": "0.0.1",
  "reviewed_at": "2026-09-24",
  "text_en": {
    "description": null,
    "habitat": "Coniferous and mixed woodland, often on nutrient-poor sandy soils, beneath pine and spruce.",
    "phenology": "Summer and autumn, overlapping with the porcini season.",
    "protection_pl": "Not subject to species protection in Poland."
  }
}
