{
  "slug": "boletus-reticulatus",
  "edibility": {
    "status": "edible",
    "note_pl": "Gatunek jadalny po prawidłowym rozpoznaniu i odpowiednim przygotowaniu.",
    "note_en": "Edible species only after correct identification and appropriate preparation.",
    "source": "https://www.first-nature.com/fungi/boletus-reticulatus.php"
  },
  "names": {
    "pl": "Borowik usiatkowany",
    "en": "Summer bolete"
  },
  "scientific_name": "Boletus reticulatus",
  "identifiers": {
    "mycobank": null,
    "index_fungorum": null,
    "gbif": null
  },
  "hymenophore": "pores",
  "habitat": "Ciepłe lasy liściaste i mieszane, często pod dębem i bukiem; lubi cieplejsze, prześwietlone stanowiska.",
  "phenology": "Wcześniej niż borowik szlachetny - często od maja lub czerwca przez lato.",
  "lookalikes": [
    {
      "slug": "boletus-edulis",
      "note": "Borowik szlachetny: siateczka zwykle tylko u góry trzonu, kapelusz gładszy, szczyt sezonu później.",
      "note_en": "Porcini: the net-like pattern is usually most visible near the top of the stem; the cap is smoother and peak fruiting is later."
    }
  ],
  "protection_pl": "Nie podlega ochronie gatunkowej w Polsce.",
  "citations": [
    {
      "label": "MycoBank",
      "url": "https://www.mycobank.org/page/Name%20details%20page/name/Boletus%20reticulatus"
    },
    {
      "label": "Index Fungorum",
      "url": "http://www.indexfungorum.org/names/names.asp?strSort=Boletus%20reticulatus"
    }
  ],
  "art": {
    "cap": "/atlas/art/v0/boletus-reticulatus.cap.svg",
    "hymenophore": "/atlas/art/v0/boletus-reticulatus.hymenophore.svg",
    "stem": "/atlas/art/v0/boletus-reticulatus.stem.svg",
    "section": "/atlas/art/v0/boletus-reticulatus.section.svg",
    "lookalike_plate": null
  },
  "pack_version": "0.0.1",
  "reviewed_at": "2026-09-24",
  "text_en": {
    "description": null,
    "habitat": "Warm deciduous and mixed woodland, often beneath oak and beech, in relatively open places.",
    "phenology": "Earlier than porcini, often from May or June through summer.",
    "protection_pl": "Not subject to species protection in Poland."
  }
}
