{
  "slug": "imleria-badia",
  "edibility": {
    "status": "edible",
    "note_pl": "Gatunek jadalny po prawidłowym rozpoznaniu i odpowiednim przygotowaniu.",
    "note_en": "Edible species only after correct identification and appropriate preparation.",
    "source": "https://www.first-nature.com/fungi/imleria-badia.php"
  },
  "names": {
    "pl": "Podgrzybek brunatny",
    "en": "Bay bolete"
  },
  "scientific_name": "Imleria badia",
  "identifiers": {
    "mycobank": null,
    "index_fungorum": null,
    "gbif": "7832732"
  },
  "hymenophore": "pores",
  "description": null,
  "habitat": "Lasy iglaste i mieszane, często pod sosnami i świerkami.",
  "phenology": "W Polsce zwykle od sierpnia do listopada.",
  "protection_pl": null,
  "text_en": {
    "description": null,
    "habitat": "Coniferous and mixed woodland, often beneath pine and spruce.",
    "phenology": "In Poland, usually August to November.",
    "protection_pl": null
  },
  "lookalikes": [
    {
      "slug": "tylopilus-felleus",
      "note": "Goryczak żółciowy ma z wiekiem różowawe pory i jest bardzo gorzki. To nie jest pełny klucz do oznaczania.",
      "note_en": "Bitter bolete develops pinkish pores with age and tastes intensely bitter. This is not a complete identification key."
    }
  ],
  "citations": [
    {
      "label": "GBIF Backbone Taxonomy",
      "url": "https://www.gbif.org/species/7832732"
    }
  ],
  "art": {
    "cap": "/atlas/art/v0/imleria-badia.cap.svg",
    "hymenophore": "/atlas/art/v0/imleria-badia.hymenophore.svg",
    "stem": "/atlas/art/v0/imleria-badia.stem.svg",
    "section": "/atlas/art/v0/imleria-badia.section.svg",
    "lookalike_plate": null
  },
  "pack_version": "0.0.1",
  "reviewed_at": null
}
